{
  "$schema": "https://json-schema.org/draft/2020-12/schema",
  "$id": "https://fabio-ara.github.io/AraLearn/authoring/schemas/audit.schema.json",
  "title": "Auditoria de uma parte",
  "type": "object",
  "required": ["artifact", "version", "runId", "partKey", "requestId", "attempt", "submissionSha256", "submissionReadReceipt", "decision", "gates", "findings"],
  "properties": {
    "artifact": { "const": "aralearn.part-audit" },
    "version": { "const": 1 },
    "runId": { "$ref": "common.schema.json#/$defs/uuid" },
    "partKey": { "$ref": "common.schema.json#/$defs/partKey" },
    "requestId": { "$ref": "common.schema.json#/$defs/requestId" },
    "attempt": { "type": "integer", "minimum": 1, "maximum": 8 },
    "submissionSha256": { "$ref": "common.schema.json#/$defs/hash" },
    "submissionReadReceipt": { "$ref": "common.schema.json#/$defs/submissionReadReceipt" },
    "decision": { "enum": ["approve", "repair", "rebuild", "blocked"] },
    "gates": {
      "type": "object",
      "required": [
        "planAlignment", "contract", "outcomeCoverage", "sources", "continuity",
        "interactionCoherence", "language", "fieldPreservation", "structuredElements",
        "feedback"
      ],
      "properties": {
        "planAlignment": { "type": "boolean" },
        "contract": { "type": "boolean" },
        "outcomeCoverage": { "type": "boolean" },
        "sources": { "type": "boolean" },
        "continuity": { "type": "boolean" },
        "interactionCoherence": { "type": "boolean" },
        "language": { "type": "boolean" },
        "fieldPreservation": { "type": "boolean" },
        "structuredElements": { "type": "boolean" },
        "feedback": { "type": "boolean" }
      },
      "additionalProperties": false
    },
    "findings": {
      "type": "array",
      "maxItems": 100,
      "items": { "$ref": "common.schema.json#/$defs/finding" }
    },
    "instructions": { "$ref": "common.schema.json#/$defs/nonEmptyText" }
  },
  "allOf": [
    {
      "if": {
        "properties": { "decision": { "const": "approve" } },
        "required": ["decision"]
      },
      "then": {
        "properties": {
          "gates": {
            "type": "object",
            "properties": {
              "planAlignment": { "const": true },
              "contract": { "const": true },
              "outcomeCoverage": { "const": true },
              "sources": { "const": true },
              "continuity": { "const": true },
              "interactionCoherence": { "const": true },
              "language": { "const": true },
              "fieldPreservation": { "const": true },
              "structuredElements": { "const": true },
              "feedback": { "const": true }
            }
          },
          "findings": { "type": "array", "maxItems": 0 }
        }
      },
      "else": {
        "anyOf": [
          {
            "properties": { "findings": { "type": "array", "minItems": 1 } }
          },
          {
            "required": ["instructions"]
          }
        ]
      }
    }
  ],
  "additionalProperties": false
}
