{
  "artifact": "aralearn.part-audit",
  "version": 1,
  "runId": "11111111-1111-4111-8111-111111111111",
  "partKey": "part-conjuncao",
  "requestId": "audit-conjuncao-attempt-1",
  "attempt": 1,
  "submissionSha256": "cccccccccccccccccccccccccccccccccccccccccccccccccccccccccccccccc",
  "submissionReadReceipt": "ZXhhbXBsZS1wZXJzaXN0ZWQtc3VibWlzc2lvbi1yZWFkLXJlY2VpcHQ.c2lnbmF0dXJlLWV4YW1wbGU",
  "decision": "approve",
  "gates": {
    "planAlignment": true,
    "contract": true,
    "outcomeCoverage": true,
    "sources": true,
    "continuity": true,
    "interactionCoherence": true,
    "language": true,
    "fieldPreservation": true,
    "structuredElements": true,
    "feedback": true
  },
  "findings": []
}
